,Marca,Nombre,Precio
0,Deiters,FisioCannabis Crema en Gel Alivio Muscular...,"10,95 €"
1,Sesderma,Serenity Bruma Rostro y Almohada,"21,50 €"
2,Sesderma,Serenity Sérum Liposomal Noche...,"34,99 €"
3,Sesderma,Serenity Mascarilla Facial Nocturna...,"25,99 €"
4,Sesderma,Serenity Crema de Noche Antienvejecimiento,"29,99 €"
5,Klorane,Gel Crema Hidratante con Agua de Aciano,"21,99 €"
6,Klorane,Bruma Corporal Hidratante de Peonía,"11,75 €"
7,Avene,Cicalfate Gel para Cicatrices,"10,99 €"
8,Ducray,Set Keracnyl Sérum + Gel Limpiador,"25,50 €"
9,Ducray,Dexeryl Crema Barrera Aislante,"10,50 €"
10,Ducray,Dermalibour + Crema Reparadora,"4,99 €"
11,Ducray,Set Keracnyl PP Crema + Gel Limpiador,"20,99 €"
12,Ducray,Set Keracnyl Control + Gel Limpiador,"20,99 €"
13,Blistex,Lip Infusion Hydration SPF15 Bálsamo Labial,"1,99 €"
14,Blistex,Lip Infusion Nourish SPF15 Bálsamo Labial,"1,99 €"
15,Bio-Oil,Gel para Piel Seca,"Desde   9,95 €"
16,Eucerin,DermatoClean Hyaluron Espuma Micelar,"10,99 €"
17,Avene,Desodorante Roll On 24h Piel Sensible,"7,95 €"
18,Sesderma,Oceanskin Crema Facial Nutritiva,"28,75 €"
19,Beauty Drops,Vitamina C al 20% + Ácido Hialurónico,"7,95 €"
20,Belcils,Pack Cejas Perfectas,"15,99 €"
21,Belcils,Máscara Sublime,"14,99 €"
22,Sesderma,Juveneses Sebum Regulador,"28,75 €"
23,Sesderma,Hidraloe Contorno de Ojos,"13,99 €"
24,Avene,Cleanance Women Cuidado Facial Nocturno...,"22,50 €"
25,Avene,Cleanance Women Sérum Corrector,"22,50 €"
26,Somatoline,Hombre Abdominales Top Definition,"49,99 €"
27,Somatoline,Reductor 7 Noches Natural,"39,99 €"
28,Somatoline,Hombre Cintura y Abdomen Intensivo,"42,99 €"
29,Somatoline,Anticelulítico Gel Crioactivo,"32,75 €"
30,Bioderma,Photerpes Stick Labial Solar SPF50+,"11,99 €"
31,Vichy,Minéral 89 Mascarilla Fortificante de...,"4,95 €"
32,Weleda,Gel de Baño Tonificante de Romero,"15,99 €"
33,Abbott,Genove Gel Dermatológico Nutritivo e...,"4,95 €"
34,NeoStrata,Skin Active Intensive Eye Therapy,"44,99 €"
35,NeoStrata,Espuma Facial Exfoliante,"31,90 €"
36,NeoStrata,Skin Active Cellular Sérum Reafirmante,"53,50 €"
37,Urgo,Crema Cicatrices,"12,99 €"
38,Lullage,RougeXpert Fluido 360º Tratamiento Intensivo,"27,50 €"
39,Lullage,RougeXpert Spray Calmante Instantáneo,"11,75 €"
40,Nuxe,Aceite Hidratante Huile Prodigieuse Or,"19,99 €"
41,Bioderma,Sensibio Tolerance+ Hipersensibilidad Cutánea,"18,99 €"
42,Bioderma,Sebium Gel Moussant Limpiador Purificante,"8,95 €"
43,Bioderma,Sensibio Forte Crema Calmante,"17,99 €"
44,Bioderma,Sébium Agua Micelar Piel Acnéica,"12,99 €"
45,Bioderma,Pigmentbio Crema Regeneradora Antimanchas,"21,50 €"
46,Nuxe,Nuxe Body Gel de Ducha Fundente,"7,95 €"
47,Nuxe,Nuxe Body Agua Relajante Perfumada,"26,50 €"
48,Nuxe,Nuxellence Sérum Noche Antiedad Detox,"45,99 €"
49,Nuxe,Crème Fraîche® de Beauté Mascarilla Facial...,"16,99 €"
50,Nuxe,Aquabella Loción Esencia Renovadora de...,"13,99 €"
51,Nuxe,Aquabella Gel Purificante Micro-exfoliante,"11,99 €"
52,Bioderma,Pigmentbio H2O Solución Micelar Iluminadora,"10,99 €"
53,Bioderma,Pigmentbio Limpiador Iluminador Foaming Cream,"11,99 €"
54,Bioderma,Pigmentbio Crema Hidratante Daily care SPF...,"21,50 €"
55,Bioderma,Pigmentbio C-Concentrate Sérum...,"24,50 €"
56,Nuxe,Nuxuriance Ultra Crema Rica Redensificante...,"45,99 €"
57,Nuxe,Merveillance Expert Contorno de Ojos,"32,75 €"
58,Nuxe,Merveillance Expert Crema Enriquecida...,"39,99 €"
59,Nuxe,Merveillance Expert Crema Lift-Firmeza,"39,99 €"
60,Sesderma,Sesgen 32 Crema Gel Activador Celular,"45,99 €"
61,Sebamed,Loción Corporal Enriquecida Pieles Secas y...,"Desde   26,99 €"
62,Nuggela & Sulé,Sérum Fortalecedor Pestañas+ Voluminizador,"33,95 €"
63,Nuggela & Sulé,Sérum Densificador Cejas+ Cepillo,"33,95 €"
64,Avene,A-Oxitive Serum Defensa Antioxidante,"35,99 €"
65,Avene,A-Oxitive Aqua Crema Alisadora,"31,90 €"
66,Triconatura,Gel Anticelulítico Reafirmante Reductor,"12,99 €"
67,Xhekpon,Máscara de Colágeno Tensor,"17,99 €"
68,Klorane,BB Contorno de Ojos Calmante,"13,99 €"
69,Isdin,Acniben RX Repair Limpiador Facial...,"15,95 €"
70,Isdin,Acniben RX Gel Crema Hidratante,"14,75 €"
71,Isdin,Ureadin Crema Manos Reparadora,"10,50 €"
72,Isdin,Ureadin Pack Crema Antiarrugas + Contorno...,"20,99 €"
73,Isdin,Acniben Limpiador Purificante,"14,99 €"
74,Elancyl,Tratamiento Anticelulítico,"30,99 €"
75,Remescar,Sérum con Vitamina C y Ácido Hialurónico,"19,99 €"
76,Vichy,Normaderm S.O.S,"16,99 €"
77,Ducray,Exomega Set Leche Emoliente y Aceite...,"14,99 €"
78,Ducray,Exoderma Set Crema Emoliente y Aceite...,"14,99 €"
79,Vichy,Liftactiv Specialist Glyc-C Ampollas...,"Desde   41,99 €"
80,Vichy,LiftActiv Specialist Péptido Ampollas...,"Desde   41,99 €"
81,Vichy,Normaderm Gel Limpiador Purificante Intenso,"Desde   13,99 €"
82,Vichy,Normaderm Tónico Purificante,"9,95 €"
83,Ducray,Bálsamo Labial,"6,95 €"
84,A-Derma,Crema Hidratante Compensadora Phys-Ac,"11,99 €"
85,Inibsa,Leche Corporal Hidratante Dermatológica,"3,99 €"
86,Inibsa,Gel Corporal Dermatológico,"3,25 €"
87,Eucerin,Atopicontrol Crema Forte,"15,95 €"
88,Eucerin,Mascarilla Facial Intensiva Antiedad,"7,50 €"
89,Neutrogena,Hydro Boost Limpiador Agua Micelar,"11,50 €"
90,La Roche-Posay,Cicaplast Baume B5,"11,99 €"
91,La Roche-Posay,Lipikar Aceite de Ducha,"17,99 €"
92,La Roche-Posay,Toleriane Ultra Desmaquillante Ojos Pieles...,"17,99 €"
93,La Roche-Posay,Tolériane Ultra 8 Concentrado Hidratante...,"18,99 €"
94,Deiters,Aceite de Rosa Mosqueta 100% Puro,"9,50 €"
95,Germinal,Crema de Día Nutrición Celular Intensiva,"19,99 €"
96,Germinal,Acción Profunda Ampollas Antioxidantes Noche,"27,50 €"
97,Germinal,Acción Profunda Ampollas Antioxidantes...,"18,99 €"
98,Germinal,Essencial Nutriplus Crema Antiedad de Noche,"26,50 €"
99,Sesderma,Sesretinal Young Gel Hidratante Plus,"45,99 €"
100,Sesderma,Crema Hidratante Acglicolic Classic SPF15,"36,99 €"
101,La Roche-Posay,Toleriane Sensitive Le Teint Creme Crema...,"16,99 €"
102,Avene,Neceser Couvrance Polvo Mosaico Bronceador...,"35,99 €"
103,Nutriceutics,Wrinkles Away Vitaminas Piel Joven,"9,95 €"
104,Cumlaude,Regenerum Gel,"11,99 €"
105,Avene,Couvrance Polvos Iluminadores,"18,99 €"
106,La Roche-Posay,Redermic Pure Vitamin C10 sérum,"39,99 €"
107,Vichy,Mineral Blend Base de Maquillaje,"Desde   16,99 €"
108,Eucerin,DermoPure Oil Control Stick Corrector,"12,99 €"
109,Vichy,Liftactiv Hyalu Mask,"31,99 €"
110,Vichy,Liftactiv Collagen Specialist,"29,75 €"
111,Vichy,Liftactiv Vitamina C Concentrado...,"26,50 €"
112,The Ordinary,B Oil,"9,20 €"
113,A-Derma,Gel de Ducha Hidroprotector,"Desde   17,99 €"
114,Germinal,Contorno de Ojos Bolsas y Ojeras,"19,99 €"
115,Remescar,Párpados Caídos,"29,99 €"
116,Avene,Couvrance Polvos Mosaico Translúcidos,"18,99 €"
117,Avene,Hydrance Perfeccionadora del Tono Enriquecida,"18,99 €"
118,Avene,Hydrance Perfeccionadora del Tono Ligera,"18,99 €"
119,Vichy,Dermablend Corrección 3D,"Desde   19,95 €"
120,Vichy,Normaderm Embellecedor Anti Imperfecciones,"16,99 €"
121,Arganour,Aceite Puro de Semillas de Higo Chumbo Bio,"19,95 €"
122,Avene,Couvrance Maquillaje Fluido,"Desde   15,99 €"
123,Avene,Couvrance Crema Compacta Acabado Mate,"18,99 €"
124,Avene,Couvrance Crema Compacta Enriquecida,"Desde   18,99 €"
125,Roc,Pro Calm Crema Calmante Reconfortante,"13,75 €"
126,Grisi,Leche de Burra Dermojabón,"3,95 €"
127,Germinal,Ampollas Flash Acción Inmediata,"15,99 €"
128,Sesderma,Glicare Gel Contorno de Ojos Y Labios,"19,99 €"
129,Sesderma,Daeses Liposomal Serum,"36,99 €"
130,Vichy,Liftactiv Flexilift Base de Maquillaje,"Desde   19,95 €"
131,La Roche-Posay,Toleriane Ultra Contorno de Ojos,"16,99 €"
132,Sesderma,Daeses Crema Gel Reafirmante Facial,"36,99 €"
133,Sesderma,C-vit Radiance Fluido Luminoso,"29,99 €"
134,Sesderma,C-vit Liposomal Serum,"29,99 €"
135,Sesderma,C-Vit Crema Facial Hidratante,"29,99 €"
136,Sesderma,Acglicolic 20 Gel Hidratante,"36,99 €"
137,Sesderma,Acglicolic 20 Crema Gel Hidratante,"38,90 €"
138,La Roche-Posay,Rosaliac Cc Cream,"17,99 €"
139,Avene,Compacto,"10,99 €"
140,Germinal,Accion Inmediata Pieles Secas,"Desde   14,99 €"
141,La Roche-Posay,Toleriane Fluido,"Desde   12,99 €"
142,La Roche-Posay,Hydreane Bb,"18,99 €"
143,Avene,Couvrance Polvos Bronceadores,"Desde   15,99 €"
144,Avene,Hydreane Bb,"Desde   15,99 €"
145,Xhekpon,Crema,"4,95 €"
146,Doctor Hauschka,Mascarilla Rejuvenecedora,"27,99 €"
